{"command":"ckc demo research-kernel --out runs/research","conflict_cards":[{"adjudication_status":"pending_adjudication","certificate_depth":"C4-Executable","certificate_evidence":[{"certificate_class":"C4-Executable","certificate_id":"cert_z3_decision_table","solver_or_checker":"z3"}],"classification":"true_conflict","conflict_id":"nf-1304fc624ef5d9196bbe4776949a4f67","conflict_type":"decision_table_overlap","explanation_en":"Detected a decision_table_overlap conflict with medium severity, classified as true_conflict.","explanation_ja":"decision_table_overlap の不整合を検出しました。重大度は medium、分類は true_conflict です。","gloss_en":"","gloss_ja":"","human_review_question_en":"In the vital-sign assessment table, temperatures >= 38.5 match both row 0 (antipyretic) and row 1 (cooling). Unique hit policy requires exactly one matching row.","human_review_question_ja":"バイタルサイン評価表で、体温38.5°C以上のとき行0(解熱薬投与)と行1(冷却処置)の両方に該当します。Unique方針では1行のみ一致する必要があります。","normalized_view":{"gap_witness":{"heart_rate":85,"matched_rows":0,"systolic_bp":95,"temperature":37.5},"hit_policy":"unique","overlap":{"output_a":"administer_antipyretic","output_b":"initiate_cooling","row_a":"row_temp_high","row_b":"row_temp_very_high","shared_condition":"temperature >= 38.5"},"table_id":"dt_vitals_triage"},"repair_candidates":[{"from":"unique","rationale":"Allow ordered evaluation with priority","to":"priority","type":"change_hit_policy"},{"new_condition":"38.0 <= temperature < 38.5","rationale":"Make rows mutually exclusive","row":"row_temp_high","type":"refine_condition"}],"severity":"medium","source_spans":[{"display_text":"体温 ≧ 38.0℃","language":"ja","raw_text":"体温 ≧ ３８.０℃","span_id":"span_cell_r0c0","table_cell":{"col":0,"row":0,"table_id":"tbl_vitals"}},{"display_text":"解熱薬投与を検討","language":"ja","raw_text":"解熱薬投与を検討","span_id":"span_cell_r0c1","table_cell":{"col":1,"row":0,"table_id":"tbl_vitals"}},{"display_text":"体温 ≧ 38.5℃","language":"ja","raw_text":"体温 ≧ ３８.５℃","span_id":"span_cell_r1c0","table_cell":{"col":0,"row":1,"table_id":"tbl_vitals"}},{"display_text":"冷却処置を開始","language":"ja","raw_text":"冷却処置を開始","span_id":"span_cell_r1c1","table_cell":{"col":1,"row":1,"table_id":"tbl_vitals"}}],"witness":[{"description":"Overlap witness: temperature=38.7 satisfies both row_temp_high (>=38.0) and row_temp_very_high (>=38.5)","encoding":"smt2","solver":"z3","status":"sat"}]},{"adjudication_status":"pending_adjudication","certificate_depth":"C7-Kernel","certificate_evidence":[{"certificate_class":"C4-Executable","certificate_id":"cert_clingo_defeasible","solver_or_checker":"clingo"},{"certificate_class":"C6-ProofObject","certificate_id":"cert_cvc5_norm_conflict","solver_or_checker":"cvc5"},{"certificate_class":"C7-Kernel","certificate_id":"cert_lean_norm_conflict","solver_or_checker":"lean"},{"certificate_class":"C4-Executable","certificate_id":"cert_z3_norm_conflict","solver_or_checker":"z3"}],"classification":"true_conflict","conflict_id":"nf-caf5b8a475bd89485b49a8a9f0a9056e","conflict_type":"norm_contradiction","explanation_en":"Detected a norm_contradiction conflict with high severity, classified as true_conflict.","explanation_ja":"norm_contradiction の不整合を検出しました。重大度は high、分類は true_conflict です。","gloss_en":"Beta-lactam antibiotics are strongly recommended for adult sepsis patients / Beta-lactam antibiotics are contraindicated in patients with a history of beta-lactam anaphylaxis","gloss_ja":"敗血症患者にはβラクタム系抗菌薬の投与を強く推奨する / βラクタム系抗菌薬にアナフィラキシーの既往がある患者には同系統薬の投与は禁忌である","human_review_question_en":"In sepsis treatment, the beta-lactam recommendation conflicts with the contraindication. Please verify the priority for patients with allergy history.","human_review_question_ja":"敗血症治療において、βラクタム系抗菌薬の推奨と禁忌が矛盾しています。アレルギー既往患者への優先順位を確認してください。","normalized_view":{"rule_contraindicate":{"action":"administer beta_lactam","direction":"against","rule_id":"rule_bl_anaphylaxis_contra","strength":"strong"},"rule_recommend":{"action":"administer beta_lactam","direction":"for","rule_id":"rule_sepsis_bl_recommend","strength":"strong"},"shared_context":"(dx sepsis) AND (allergy_history beta_lactam anaphylaxis)"},"repair_candidates":[{"exception":"beta_lactam_anaphylaxis","rationale":"Exclude allergy patients from recommendation scope","rule":"rule_sepsis_bl_recommend","type":"add_exception"},{"rationale":"Absolute contraindication overrides recommendation","superior":"rule_bl_anaphylaxis_contra","type":"add_priority"}],"severity":"high","source_spans":[{"display_text":"βラクタム系抗菌薬にアナフィラキシーの既往がある患者には、同系統の抗菌薬の投与は禁忌である","language":"ja","raw_text":"βラクタム系抗菌薬にアナフィラキシーの既往がある患者には、同系統の抗菌薬の投与は禁忌である","span_id":"span_contra_bl_allergy","table_cell":null},{"display_text":"敗血症患者にはβラクタム系抗菌薬の投与を推奨する(推奨の強さ:強、エビデンスの確実性:中)","language":"ja","raw_text":"敗血症患者にはβラクタム系抗菌薬の投与を推奨する（推奨の強さ：強、エビデンスの確実性：中）","span_id":"span_rec_sepsis_bl","table_cell":null}],"witness":[{"description":"Shared context satisfiable: patient with sepsis AND beta-lactam anaphylaxis history exists","encoding":"smt2","solver":"z3","status":"sat"}]},{"adjudication_status":"pending_adjudication","certificate_depth":"C4-Executable","certificate_evidence":[{"certificate_class":"C4-Executable","certificate_id":"cert_clingo_event_calculus","solver_or_checker":"clingo"}],"classification":"true_conflict","conflict_id":"nf-739a255b7a7336ba8966f25d3e9df18f","conflict_type":"temporal_violation","explanation_en":"Detected a temporal_violation conflict with high severity, classified as true_conflict.","explanation_ja":"temporal_violation の不整合を検出しました。重大度は high、分類は true_conflict です。","gloss_en":"Beta-lactam antibiotics are strongly recommended for adult sepsis patients / Beta-lactam antibiotics are contraindicated in patients with a history of beta-lactam anaphylaxis","gloss_ja":"敗血症患者にはβラクタム系抗菌薬の投与を強く推奨する / βラクタム系抗菌薬にアナフィラキシーの既往がある患者には同系統薬の投与は禁忌である","human_review_question_en":"Event Calculus shows allergy_known persists from detection (t=0) to drug administration (t=10), detecting administration under active contraindication.","human_review_question_ja":"イベント計算により、アレルギー歴(t=0)から薬剤投与(t=10)まで allergy_known が持続し、禁忌状態での投与が検出されました。","normalized_view":{"event_calculus":{"happens_administer_drug_t10":true,"happens_detect_allergy_t0":true,"holds_allergy_known_t10":true,"initiates_allergy_known_t0":true,"no_terminating_event_before_t10":true,"violation":"Drug administered at t=10 while allergy_known holds (contraindication active)"}},"repair_candidates":[{"action":"administer_drug","guard":"NOT holds(allergy_known, t)","rationale":"Administration must check allergy status before proceeding","type":"add_temporal_guard"}],"severity":"high","source_spans":[{"display_text":"薬物アレルギー歴の確認において、過去にβ-ラクタム系抗菌薬によるアナフィラキシーが認められた場合は、当該薬剤群を回避する","language":"ja","raw_text":"薬物アレルギー歴の確認において、過去にβ-ラクタム系抗菌薬によるアナフィラキシーが認められた場合は、当該薬剤群を回避する","span_id":"span_allergy_history","table_cell":null},{"display_text":"βラクタム系抗菌薬にアナフィラキシーの既往がある患者には、同系統の抗菌薬の投与は禁忌である","language":"ja","raw_text":"βラクタム系抗菌薬にアナフィラキシーの既往がある患者には、同系統の抗菌薬の投与は禁忌である","span_id":"span_contra_bl_allergy","table_cell":null},{"display_text":"敗血症患者にはβラクタム系抗菌薬の投与を推奨する(推奨の強さ:強、エビデンスの確実性:中)","language":"ja","raw_text":"敗血症患者にはβラクタム系抗菌薬の投与を推奨する（推奨の強さ：強、エビデンスの確実性：中）","span_id":"span_rec_sepsis_bl","table_cell":null}],"witness":[{"description":"EC stable model confirms allergy_known persists from t=0 to t=10 with no terminating event","encoding":"asp","models":1,"solver":"clingo","status":"SAT"}]}],"producer_version":"0.0.0","summary":{"certificate_depth_distribution":[{"certificate_class":"C4-Executable","count":8},{"certificate_class":"C6-ProofObject","count":2},{"certificate_class":"C7-Kernel","count":1}],"conflict_taxonomy_counts":[{"conflict_type":"decision_table_overlap","count":1},{"conflict_type":"norm_contradiction","count":1},{"conflict_type":"temporal_violation","count":1}],"n_claims":2,"n_conflicts":3,"n_documents":3,"n_rules":3,"n_spans":16}}